{
  "世界": {
    "日期": "未记录",
    "时段": "白天",
    "地点": "未记录",
    "天气": "未记录",
    "威胁等级": "平静",
    "在场者": []
  },
  "主控": {
    "称呼": "待登记",
    "来历": "待登记",
    "专长": "待登记",
    "行事倾向": "待登记",
    "当前目标": "待登记",
    "身体": {
      "体力": 100,
      "伤势": 0,
      "精神": 100,
      "脱水小时": 0,
      "饥饿小时": 0,
      "清醒小时": 0
    },
    "感染": {
      "可疑暴露": false,
      "暴露原因": "",
      "是否确认": false,
      "剩余小时": 36,
      "已处置": []
    },
    "觉醒": {
      "是否觉醒": false,
      "能力类别": "未觉醒",
      "等级": 0,
      "觉醒代价": 0,
      "恢复小时": 0,
      "身份是否暴露": false,
      "失控风险来源": ""
    },
    "物资": {
      "口粮": 0,
      "饮水": 0,
      "药品": 0,
      "弹药": 0,
      "燃料": 0
    },
    "装备": []
  },
  "同伴": {},
  "势力": {},
  "据点": {},
  "悬念": {},
  "现场": {
    "敌对单位": [],
    "可调查目标": [],
    "暴露与噪音": 0,
    "掩体与退路": ""
  },
  "系统": {
    "已登记": false,
    "时段计数": 0,
    "上次后台推进": "未开始",
    "难度基调": "严酷但不无解",
    "备注": ""
  }
}
